{"$schema":"https://json-schema.org/draft/2020-12/schema","additionalProperties":false,"properties":{"authored_timestamp":{"format":"date-time","type":"string"},"authoring_authority":{"minLength":1,"type":"string"},"authority_id":{"minLength":1,"type":"string"},"authority_type":{"const":"expectation_authority"},"case_definition_role":{"minLength":1,"type":"string"},"expectation_schema_role":{"minLength":1,"type":"string"},"normative_source_role":{"minLength":1,"type":"string"},"observation_dependency":{"const":"FORBIDDEN"},"schema_version":{"const":"6.0.0-DRAFT"}},"required":["authority_id","authority_type","authored_timestamp","authoring_authority","case_definition_role","expectation_schema_role","normative_source_role","observation_dependency","schema_version"],"title":"R4 expectation authority","type":"object"}
