{"authored_timestamp":"2026-07-22T10:30:00Z","authoring_authority":"RANDLE-R4-EXPECTATION-AUTHOR-1","authority_id":"RANDLE-R4-EXPECTATION-AUTHORITY-1","authority_type":"expectation_authority","case_definition_role":"case_definitions","expectation_schema_role":"independent_expectations_schema","normative_source_role":"specification","observation_dependency":"FORBIDDEN","schema_version":"6.0.0-DRAFT"}
